image_path,caption
unsplash_pairs\images\uQs1802D0CQ.jpg,"avocado, tomatoes, eggs, mushrooms, spring onions, and leaves"
unsplash_pairs\images\fT6-YkB0nfg.jpg,"Empire State Building, New York at night"
unsplash_pairs\images\TaCk3NspYe0.jpg,"Time Square, New York during daytime"
unsplash_pairs\images\8bjnP3yhNTg.jpg,"aerial photography of city, body of water, and forest"
unsplash_pairs\images\NjbsEkkvOwc.jpg,"aerial photography of Manhattan, New York"
unsplash_pairs\images\_wqj9tC0WSE.jpg,"Empire State Building, New York during day"
unsplash_pairs\images\ZOG7Zj7cfR8.jpg,"Sears Tower, USA under white clouds at daytime"
